{
  "ticker": "PLTR",
  "name": "Palantir Technologies Inc.",
  "market": "US",
  "asof": "2026-05-01T00:00:00Z",
  "health": {
    "revenue_trend": [553, 678, 726, 828, 884, 1003, 1180, 1407],
    "op_margin_trend": [0.36, 0.37, 0.38, 0.45, 0.44, 0.46, 0.46, 0.46],
    "net_margin_trend": [0.05, 0.07, 0.10, 0.15, 0.18, 0.25, 0.30, 0.36],
    "fcf_trend": [149, 240, 435, 517, 370, 569, 540, 620],
    "roe": 0.18,
    "debt_to_equity": 0.19,
    "current_ratio": 5.2,
    "peer_percentile": {
      "growth": 0.99,
      "margin": 0.95,
      "leverage": 0.95
    },
    "narrative": "Best-in-class fundamentals: +56% FY25 revenue, ~46% adj op margin, $2.1B FCF, zero long-term debt. Rule-of-X >110. Story has fully shifted from fundamentals risk to valuation risk."
  },
  "earnings": {
    "consensus": {
      "next_quarter_eps": 0.28,
      "next_quarter_rev": 1540,
      "fy_eps": 1.20,
      "fy_rev": 7300,
      "revision_30d_pct": 2.5,
      "whisper_gap_pct": 3.5
    },
    "surprise_history": [
      {"date": "2024-02-05", "eps_surprise_pct": 20, "rev_surprise_pct": 5,  "ret_t1":  0.31, "ret_t5":  0.25, "ret_t20":  0.18},
      {"date": "2024-05-06", "eps_surprise_pct":  0, "rev_surprise_pct": 2,  "ret_t1": -0.15, "ret_t5": -0.10, "ret_t20": -0.07},
      {"date": "2024-08-05", "eps_surprise_pct": 20, "rev_surprise_pct": 3,  "ret_t1":  0.10, "ret_t5":  0.14, "ret_t20":  0.20},
      {"date": "2024-11-04", "eps_surprise_pct": 25, "rev_surprise_pct": 5,  "ret_t1":  0.23, "ret_t5":  0.27, "ret_t20":  0.40},
      {"date": "2025-02-03", "eps_surprise_pct": 27, "rev_surprise_pct": 7,  "ret_t1":  0.24, "ret_t5":  0.20, "ret_t20":  0.30},
      {"date": "2025-05-05", "eps_surprise_pct": 10, "rev_surprise_pct": 4,  "ret_t1": -0.08, "ret_t5": -0.03, "ret_t20":  0.08},
      {"date": "2025-08-04", "eps_surprise_pct": 12, "rev_surprise_pct": 5,  "ret_t1":  0.05, "ret_t5":  0.08, "ret_t20":  0.18},
      {"date": "2025-11-03", "eps_surprise_pct": 24, "rev_surprise_pct": 8,  "ret_t1": -0.08, "ret_t5": -0.03, "ret_t20":  0.05},
      {"date": "2026-02-02", "eps_surprise_pct":  9, "rev_surprise_pct": 7,  "ret_t1":  0.24, "ret_t5":  0.18, "ret_t20":  0.12}
    ],
    "reaction_pattern": {
      "surprise_gt_15pct": {"n": 5, "avg_t1":  0.20, "avg_t5":  0.18, "avg_t20":  0.24, "hit_ratio": 0.80},
      "surprise_5_to_15pct": {"n": 3, "avg_t1":  0.02, "avg_t5":  0.01, "avg_t20":  0.11, "hit_ratio": 0.67},
      "surprise_lt_5pct": {"n": 1, "avg_t1": -0.15, "avg_t5": -0.10, "avg_t20": -0.07, "hit_ratio": 0.00}
    },
    "pre_announcement_drift": {
      "price_change_pct": -0.05,
      "volume_zscore": 0.8,
      "implied_signal": "Defensive positioning into print: stock -22% YTD, -31% from highs, software cohort de-rating (NOW/IBM misses). Options-implied 10.5% post-print move, lower than Q3'25 setup. Pre-print pessimism marginally improves base-case risk/reward."
    },
    "next_earnings_date": "2026-05-04",
    "scenario": {
      "base_case": "Rev $1.55-1.60B, FY26 raised to $7.30-7.40B. Consensus +4% beat; T+1 -3% to +5% chop, T+5 drifts to flat-to-up. Probability ~50%.",
      "beat_case": "Rev >$1.62B, FY26 raised to $7.5B+. Replay of Q4'25 reaction: T+1 +10-18%, sustains through T+5. Probability ~30%.",
      "miss_case": "Rev <=$1.55B with FY26 reiterated at $7.18-7.20B (no raise) reads as a soft print given whisper $7.4B+; T+1 -10% to -15%, fwd P/E re-rates toward 85x. Outright miss (rev below guide) ~5% tail, T+1 -20%+. Probability of soft scenario ~15%."
    }
  },
  "valuation": {
    "pe": 130.0,
    "fwd_pe": 109.0,
    "ev_ebitda": 95.0,
    "pbr": 28.0,
    "peer_pe_median": 18.0
  },
  "risks": [
    {"label": "Valuation compression", "severity": "high", "rationale": "Fwd P/E ~109x vs SaaS peer median ~18x; multiple is the dominant near-term return driver. Any growth-durability doubt risks 30%+ derate."},
    {"label": "Guidance under-raise", "severity": "high", "rationale": "Buyside whisper FY26 ~$7.4B+. Reiterating $7.18-7.20B insufficient given Q4'25 momentum."},
    {"label": "AIP commercial deceleration", "severity": "medium", "rationale": "US-Comm +137% YoY Q4'25 is a hard comp. Sequential decel even to +90% read as topping."},
    {"label": "Government concentration / political", "severity": "medium", "rationale": "~55% of revenue is US Gov. Defense-AI tailwind supportive; recurring DOJ/FTC data-practices tail risk."},
    {"label": "Insider 10b5-1 selling pace", "severity": "medium", "rationale": "Continued sizable insider sales (Karp, Cohen) act as sentiment headwind on weak tape."},
    {"label": "Software-sector risk-off", "severity": "medium", "rationale": "NOW/IBM April 2026 misses dragged PLTR -8%. High cohort beta during multiple-compression cycles."},
    {"label": "SBC dilution", "severity": "medium", "rationale": "Stock-based comp ~20%+ of revenue; GAAP-vs-adjusted gap large; falling stock compounds dilution."},
    {"label": "No buyback offset", "severity": "low", "rationale": "Buyback authorization not material vs. SBC; share count rises ~3-5%/yr."}
  ],
  "evidence": [
    {"source": "Palantir IR Q4 2025 release", "url": "https://investors.palantir.com/news-details/2026/Palantir-Reports-Q4-2025-U-S--Comm-Revenue-Growth-of-137-YY-and-Revenue-Growth-of-70-YY-Issues-FY-2026-Revenue-Guidance-of-61-YY-and-U-S--Comm-Revenue-Guidance-of-115-YY-Crushing-Consensus-Expectations/"},
    {"source": "CNBC Q4 2025 coverage", "url": "https://www.cnbc.com/2026/02/02/palantir-pltr-q4-2025-earnings.html"},
    {"source": "CNBC Q3 2025 coverage", "url": "https://www.cnbc.com/2025/11/03/palantir-pltr-q3-earnings-2025.html"},
    {"source": "TipRanks Q1 2026 preview, options-implied move", "url": "https://www.tipranks.com/news/palantir-pltr-q1-earnings-on-may-4-options-market-braces-for-a-10-55-swing"},
    {"source": "Schaeffer's pre-print analysis", "url": "https://www.schaeffersresearch.com/content/analysis/2026/04/30/palantir-stock-shakes-off-big-tech-weakness-ahead-of-earnings"},
    {"source": "GuruFocus forward P/E", "url": "https://www.gurufocus.com/term/forward-pe-ratio/PLTR"},
    {"source": "StockAnalysis.com balance sheet", "url": "https://stockanalysis.com/stocks/pltr/financials/balance-sheet/"},
    {"source": "Macrotrends quarterly revenue", "url": "https://www.macrotrends.net/stocks/charts/PLTR/palantir-technologies/revenue"},
    {"source": "Zacks Q4 2024 surprise note", "url": "https://www.zacks.com/stock/news/2408782/palantir-technologies-inc-pltr-beats-q4-earnings-and-revenue-estimates"}
  ],
  "confidence": 0.50,
  "markdown_report_path": "/home/user/pb/reports/fundamentals/PLTR-2026-05-01.md"
}
